Tweets,Sentiment_Score,Relative_Time,Continent_Code,Reach
putin could easily launched virulent propaganda campaign claiming invade mexico minute threatening severe repercussion taking credit invasion fails occur bold stance biden regime,0,15,NAM,26
joe manchin floor biden supreme court ser say would stop second pick close election via,4,14,NAM,25
america soldier sailor airman marine guardsman respected around world courage professionalism patriotism president longer good enough new commander chief want troop woke,0,4,NAM,108
love president honest american people trump lied several time every single day,4,18,NAM,118
enters white house donald trump say right take presidency responds perhaps left,2,2,NAM,85
crisis govt mull flight bring student india new delhi february russian troop partially pulled border area tension remained high president warned,0,0,NAM,119
latest german chancellor olaf scholz president agree situation must assessed extremely serious still risk russian military aggression german government spokesperson steffen hebestreit said wednesday,0,2,ASI,33
friend keep telling joe old president well sure could run year ago biden time,4,24,NAM,42
conflict told citizen leave immediate effect russia attack anytime,0,3,ASI,52
russian president signaled want peaceful path president promised would continue give diplomacy every chance struck sceptical tone moscow intention,0,23,NAM,71
poo admitted russia ship fart product sleepy defended going brought nft thought artificial intelligence wish butt make,0,8,NAM,50
biden ruled coming direct defense yet drumbeat war ironically coming russia washington show russia outsmarted america amp europe royally screwed match putin,0,9,ASI,26
guess putin thought president going easy pushover like donald trump always groveling foot,0,6,NAM,91
really slap face president amp kamala harris hear people say done may given wanted damn sure giving need,4,21,NAM,114
russia claim pulling troop back official say press red button joe sleeping allowed,0,15,NAM,115
though trump maverick leader kept china russia leash dare tweak thumb usa softie compared,2,3,ASI,16
biden administration defies court ruling opts holding oil drilling sale via let drill oil buy putin begs saudi drill crazy action expected biden,0,15,NAM,41
news russia decided invade approval northern border inundated canadian refugee fleeing communism climate changed today winter death officially expires march,0,1,NAM,62
russian military drill conclude troop withdrawal begin white house proclaims stunning strength brilliant strategic thinking averted thermonuclear war,4,13,NAM,65
stephen king happy new administration worst president history president trump incredible president,0,10,NAM,63
china accused united state playing threat warfare creating tension president warned russian troop still massed near border following moscow,0,1,EUR,0
russian invasion happen anytime white house russian invasion happen anytime white house said wednesday president announced plan dispatch vice president kamala harris,2,0,ASI,120
spent time worrying happening america instead russia america would shit,0,19,NAM,30
many forgotten joe office one year many dems ready boot blocked every turn republican apparently trust putin higher number president biden vote blue senate must majority,4,12,NAM,17
president biden say everything power provide relief conflict disrupt supply oil gas fact check team looked option,4,18,NAM,30
upcoming invasion like plan vacation diplomat mock medium according politico newspaper president claimed russia could allegedly attack february,0,24,NAM,49
world wait russia next move president warning invasion would direct impact energy price already contributing highest inflation year story,0,10,NAM,68
urge putin back brink war sends message peace russian,0,10,NAM,85
president ordering release trump white house visitor log house committee investigating riot january,0,10,AUS,27
opinion sleepy making vladimir putin blink new york time via,2,10,NAM,50
could call president sweetheart guy true romantic leading president mass shooting death mass shooting valentine day america,4,12,NAM,3
president biden need get least two republican sers side joe sinema never agree build back better even supreme court justice forget bipartisanship president like,4,23,NAM,48
washington president ordering release trump white house visitor log house committee investigating riot rejecting former president donald trump claim executive privilege,0,1,NAM,32
according president russian troop still amassed cock ball,0,15,NAM,36
international committee fourth international icfi world socialist web site unequivocally oppose reckless drive washington ally instigate war russia,0,11,EUR,7
france urge revamp europe security order face russia threat french foreign minister drian say emerged stronger current crisis read,0,16,EUR,24
send new battle group eastern europe russia fails deliver,0,22,SAM,22
attempting join massive threat russian national security biggest european border thus explaining troop new western force russia permanently deterrent imo,4,14,NAM,47
joint statement issued senior group european russian security expert outlined plan defusing crisis see deep cut commission statement,0,5,NAM,47
latest update say sign russia crisis news jazeera,0,18,NAM,55
putin troop way say russia yet situation border abc news,2,19,AUS,16
say sign russia pulling back troop near via,2,6,NAM,11
crisis russia take seriously anymore,0,4,AUS,28
considerable time issue russia huge soft power idea russia seriously pitched dismissed outlandish putin lost cool rest history say,4,11,EUR,51
russia could settle moratorium ukrainian membership say two decade something alliance able accept plan kyiv membership anyway via,4,5,NAM,15
chief question russian troop retreat,4,9,ASI,36
sign russian withdrawal border yet according president voldymyr zelenskyy,2,14,NAM,23
robust strategy must bolster defense capability meet challenge effectively pick read,4,3,NAM,32
confirming assessment chief defence intelligence said seen evidence withdrawn force border,4,12,EUR,19
speaking meeting defence minister brussels jens stoltenberg stress sign military russia,0,13,EUR,36
live update increasing troop number say kremlin issue energy supply warning europe,0,3,NAM,29
blame putin demanding stay otherwise make usa giant hypocrite say thing cuba entire western hemisphere,0,0,NAM,15
satellite image prove russian failure withdraw troop say,0,1,EUR,28
today satellite imagery show russian military building field hospital near border,2,21,EUR,8
deem russia persistent threat europe add battlegroups response,0,2,NAM,20
remember saying side need deescalate tension view formed keep russia check maybe talk allied nation making statement would good,4,21,NAM,26
russia continuing military buildup around chief said seen via,2,20,NAM,54
shitshow unity russia latest military movement stoke confusion,0,6,NAM,27
member let putin try invading country real test,2,8,NAM,6
russia still building force border say top official,4,21,AUS,21
biden question stand everything place pandemic biden reversed entering office highest gdp best employment energy independence controlled border paying fair share war joe change chuckie must fix,4,7,NAM,54
former head sir given startling interview radio outline view russia never intention invading amp threat greatly exaggerated western leader,0,20,NAM,8
ukrainian pacifist say russia share responsibility avoid war via,0,21,NAM,36
russia increasing troop number say kremlin issue energy supply warning europe,0,13,EUR,43
alliance chief say russia continuing military near border,2,5,EUR,3
maybe putin upset biden pushing join russia army maybe like could wrong,0,1,NAM,10
germany need nord stream expect germany putting ukrainian adventurism think france either force conflict donbas may split also split partition may sensible,4,12,NAM,22
bluff expensive work strengthened military increased sentiment neighboring country led presence eastern europe russian force massing preparing infrastructure seems like putin still planned,4,24,NAM,51
germany tired wating assumed putin would next meaning stand moveback base unified see putin need understand cutting germany investment yearly,0,18,EUR,21
ally bolstered defense sending troop equipment amp began providing drone kyiv prepares unplug russian electricity amid fear invasion,0,7,NAM,29
tulsi gabbard fox talking inflation gas price amp russia,0,21,NAM,6
well fox news china say russia threat via,0,13,NAM,35
important know announced russian troop withdrawal exercise crimea,4,15,NAM,37
blamed russia ongoing military escalation united state,0,8,NAM,22
think better wake going fight war democracy china russia,0,5,NAM,19
sign withdrawal troop near chief say news,2,4,NAM,45
sign withdrawal troop near chief say via,2,16,NAM,23
firstft say russian troop number still rising near,2,14,EUR,48
ally gang russia despite troop draw full show via,2,13,NAM,44
cite continuing russian threat despite pullback claim washington post,0,22,NAM,52
breaking news reject claim russian troop pulling back still russia,0,17,NAM,6
chief contradicts russia withdrawal claim say proof pulling back,0,20,EUR,19
fyi stalin russia died georgia putin actually want join took better operation western europe people want sell arm would like,0,6,EUR,30
russia want autonomous region within prevent joining want chaos kill nordstream sell gas usual rich powerful stoking conflict gain power make money,0,0,NAM,8
think russia going keep withdrawing troop sends troop border wont using intimidation get russia back,4,10,NAM,34
ukrainian president volodymyr zelensky say evidence russia withdrawing troop,2,18,NAM,51
say russian troop number still rising near border,2,18,EUR,26
russia invaded involved ready battle russian mil devastated superior tech capability would significant military defeat russia battle ready deployed least day,0,23,EUR,2
let take nice long look current crisis right russia troop give take border member state want still sending troop border escalating situation,0,4,NAM,11
bolton supporter stretch point agree bolton love war personally believe war profiteer right right would disbanded rolled red carpet right kyiv russian troop,4,23,NAM,29
current crisis russia west fueled fallacious claim russian president vladimir putin misled soviet union would expand east source link,0,14,NAM,4
russia weapon venezuelan cuba mexico border hypocrisy,0,5,EUR,38
biden tell putin trump never would defend every inch territory,2,10,NAM,9
warns russia still building troop hold defiant national holiday,4,8,NAM,9
sentient would invade failed state nothing liability intervention protect population ethnic russian would win mention russia rightly never let join,0,16,NAM,46
china accuses playing threat warfare russia click link detail,0,11,ASI,5
give goof mst february get invasion commenced want biden member leader stoltenberg drink hemlock commit ignore statement future start intelligence,4,16,NAM,37
anybody stop think troika tyranny true threat russia responding,0,17,NAM,5
national security doctrine clearly stipulates russia china enemy biden lying saying russia enemy,0,4,NAM,52
fascinating always doug putin clearly old trick west eyeball glued border putin really want might bearing russia goad feign innocence,4,10,EUR,1
russia west react via,0,8,NAM,12
troop sent crimea annexed putin know would respond minimal eastern member worried concerned putin irrational behaviour,0,17,EUR,41
would sent troop attack russia giving russia excuse enter pull troop finally gotten,0,13,NAM,4
weakness mistake biden trump biden standing putin trump licked putin boot daily,0,0,NAM,7
putin want granting could beginning end,4,23,EUR,44
russia afraid russia join enjoy safety benefit unity,4,20,NAM,3
washington alerted russia attack feb deadline passed mean putin backed pressure west silently agreed russian term extending washington propaganda,0,22,EUR,40
russia gon start nuclear war either,0,16,NAM,12
say still see sign russia pulling back force ukrainian border despite claim moscow troop begun returning,2,24,EUR,11
report scale troop missile eastern europe feel like fairly important part balanced reporting,4,20,EUR,11
well okay like putin admired west much russia need west already aware whole thing come bush offering membership,4,17,EUR,8
concern macron naivete amp proclivity undermine western unity overblown french president neither rogue compromise interest nonaligned european state led foster dialogue russia,0,19,EUR,52
earlier balance risk tilted upside amid lingering tension eastern europe tightening global oil supply official accused russia concentrating troop ukrainian border day moscow insisted withdrawn force,0,6,SAM,36
crisis considering new battlegroups eastern europe sign russian live,0,21,NAM,33
russia moving force border say military intelligence,4,16,EUR,29
russia still upping troop border blinken seen pullback via,2,7,EUR,14
talking country rushed join decade becoming free soviet oppression russia threaten invade reason likely,4,16,EUR,19
let remind want join russian aggression russia annexed crimea waging war donbas year row,0,5,EUR,54
word word newsletter leader warns russia still building force yet assign blame cyberattacks cdc say cautiously optimistic omicron decline,0,14,NAM,4
keep pushing war scenario russia china asserting going happen responsible tense atmosphere social instability,0,21,NAM,42
tech update buying russia claim pulling troop away let discus,2,18,EUR,5
fate rest one person hand biden putin attack russia granted serious concession would hurt diplomacy biden domestically would save countless russian ukrainian life,0,3,NAM,1
yeah russia treatment neighbor speaks getting soviet union back much putin want fuck neighbor friendly become,4,17,NAM,40
andy vermaut share russia still building troop near say submitted link comment thank,4,15,EUR,34
suggest embassy staff russia provide free membership paid seized russian asset stimulus check russian soldier feed family,4,4,NAM,0
official joined western nation saying yet see evidence russia pulling back troop near shared border russia claimed earlier week,4,14,NAM,31
little thing troop border mean would russia shrug mobilized troop polish border belarus said nothing worry,4,1,NAM,2
wonder russia would think amassed troop poland belarus border would believe,2,0,NAM,50
given happened crimea ukrainian try join imperialist russia bullying consequence,0,4,NAM,47
russia reason interest invade however thing amp tolerate massive ukr army conquest missile amp troop southern border solution simple,4,23,NAM,37
crisis latest news reject moscow claim initial pullback,0,23,NAM,15
russia invade flexing muscle showing rest world keeping poking dog bite back invade start setting base,2,17,EUR,13
russia still troop border yesterday simply reinforcing aid russia still aggressor take cringe,0,18,NAM,23
discussion move war russia forward union split time set fighting war russia,0,0,NAM,46
blaming trump inept handing russia stop gqp talking point put forth fact lie match reality,0,23,NAM,18
russian official clash status troop near world recognizes vladimir putin kgb trained lier using conflicting lie confuse bluff distract enemy,0,0,NAM,44
vladimir putin disregard presence world power anything returned back action prepared every move,0,17,NAM,32
oil gold rose wednesday united state said russia increasing troop near dovish reading minute last federal reserve meeting helped stock close mostly flat wall street,4,5,ASI,9
official say seen major withdrawal russian troop border despite announcement week putin russian military official ordered troop return home base,4,1,NAM,19
covering chief see today russia maintains massive invasion force ready attack,0,16,NAM,12
impending invasion continue see evidence russia cbs discus vladimir putin strategy delaying attack may best interest,4,22,NAM,37
interestingly know carrying exercise bridge infrastructure field hospital thousand wounded armed helicopter passing border town interesting,4,5,EUR,15
reasonable summary thing stand russia concerning discount biden speech javelin missile resolve putin risk calculator input germany macron vacillation,4,24,NAM,7
excuse brother created soviet union warsaw pact soviet union warsaw pact still come near russia border already country share border russia saying putin bully,2,23,ASI,7
believe putin blink primary goal weaken failed miserably would economic hit china bail everything lose nothing gain invasion,0,20,NAM,47
moscow demand separate treaty declined understands guarantee geographic demographic economic amp military resource say,0,24,ASI,28
else would explain massive troop presence along border potential membership appears primary source dispute ongoing negotiation even negotiating russia issue,0,16,NAM,41
please ready russian weather modification technology freeze possible busy attack donot think russia finish invade territory,4,4,ASI,25
putin may say pulling back troop official see sign putin lie see anyone buy want bet tucker carlson back putin claim based research,0,17,NAM,50
united state created vladimir putin,4,14,NAM,36
lmao invading fact actually pulling troop border probably scare tactic get back,4,5,EUR,0
russia added field hospital near border created new strategic bridge near belarus added new troop way pulling back gon quite time history,4,18,NAM,7
usa today russia increased military presence along border official senior administration official said russia added troop along ukrainian border recently contrast claim pulling back,4,20,EUR,25
fake news usa sending troop troop going country poland,0,12,NAM,35
russia increased military presence along border recent day official via,4,19,NAM,53
senior administration official said russia added troop along ukrainian border recently contrast claim pulling back,2,21,NAM,21
think putin trying find excuse reported added troop last putin want keep guessing know bomb russian force russian soil even invade,0,18,EUR,24
say russia added troop along border despite claim pullback putin trying deceive president biden,0,1,NAM,20
russia increased military presence along border recent day official say,4,14,NAM,40
president vladimir putin russia military base poland another romania evidence see threat posed eastward expansion part justification military encirclement,0,24,NAM,31
former ambassador bill taylor quincy institute lieven debate whether russian national security establishment legitimate concern war expansion,0,17,NAM,16
say sign russia pulling back troop near russia say russia secretary state antony blinken said wednesday via,2,22,NAM,39
president warning american prepare economic pain russia invades administration decides levy sanction moscow response,0,1,NAM,55
plan new possible battlegroups europe amid russia tension stoltenberg,0,24,EUR,20
still pushing narrative russia along provoking russia vlad join western world leader hesitate sacrifice city world never getting islam,0,23,NAM,13
expicitly alliance earth would want russia join russia want join,4,0,AUS,55
comment risk russian invasion greatest west part close russian encirclement high risk area possible escalation,0,9,EUR,3
deploying troop central amp south eastern europe russia accused removing troop ukrainian border hrh prince wale face police investigation claim charity secured cbe saudi businessman donating call duke york losing title,4,23,EUR,6
perfectly understandable would want join military alliance russia specifically president russia really see point view,4,21,NAM,26
circumstance putin looking excuse start war working prevent one,0,24,EUR,49
russian video show tank leaving annexed crimea disputing claim understand russia want invade anything russia want missile minute range moscow,0,12,EUR,52
take looksie map see border russia belarus russian pal pooty much care idea country footstep away russian border reason biggie,4,21,ASI,17
insight market end flat negative fomc minute minute show rate hike shrink balance sheet official accused russia concentrating troop ukrainian border crude oil slip,0,20,ASI,38
biden ask putin saying troop withdrawing america germany show troop advancing,2,7,NAM,9
russia looking strategic depth already force donbas region crimea belarus time putin something else mind moscow want dictate european security putting stop eastward expansion,4,0,NAM,40
amp independent analyst group reported russia may actually increasing force around border russia dismissed claim,2,18,ASI,34
strange since gave assurance would expand return russia agreeing german reunification moved east final move advanced outside russian border aggressor,4,18,NAM,1
putin plan backfire expanding romania ready host increased troop needed president say,4,18,NAM,22
regardless crisis end broader issue remain elevated bluffed collapse moscow bluffed putin destabilized power circle ensures perpetual hostility one leaf,0,1,NAM,17
april biggest russian military buildup near border since rattled international community moscow next russia insists simply responding military drill near territory,2,19,NAM,48
watching house hearing russia putin aggression unqualified goon richard grenell acting role cuz could get confirmed due zero expertise litterally say real prob german undermining wtf russia putin,0,8,NAM,28
although yet member partnered military alliance development angered putin view independent nation land lost result end cold war,0,21,NAM,35
discussing bit say know weekend speak massive buildup russia say nyet pulling back troop planned exercise nothing see statement whiz past via crimea,2,8,NAM,20
biden weak president putin would chill ppl combined russia,0,6,NAM,18
quite happy russia stay least american nuclear missile cause crisis america country must accept blame crisis caused,0,3,EUR,17
putin either going back hell going hit man sanction economy shit already bring troop dug damn hole jump,0,9,NAM,46
russia say begun partial troop pullback border urge caution,2,24,NAM,47
biden told putin try backed ukrainian force ready,0,9,NAM,1
unprecedented amount troop country near russian border say like style guide suggests sound much aggressive saying troop poland slovakia estonia,4,19,NAM,54
story tonight rush hour skeptical washington pushed back russia claim moving force away ukrainian border today ally accusing russia adding bringing back prof true,0,12,NAM,7
found newsbreak local news app used million people buying russia claim pulling troop away world peace,4,4,NAM,53
stoltenberg said intelligence showed russia would invade february russia moved troop back base military exercise stoltenberg insisted heading way amp intelligence used sentence warmongering,4,17,EUR,38
get piece eastern year pause put rest ambition get certain top secret assurance arctic russia many little detail ensure sovereignty,4,23,NAM,47
russia traditional legitimate security concern expansion putin main goal pushing towards russian style faux democracy ruled strongman oligarch putin fear losing grip power,0,23,NAM,31
russia middle east military buildup putin want watchman newscast,2,18,EUR,37
seen sign significant pullback russian troop ukrainian border tuesday russian president vladimir putin announced partial withdrawal russian troop surrounding,4,20,ASI,0
putin continue humiliate biden joke worn dont fooled russia surrender sea azov country threatening join,0,17,NAM,26
though doubt hope rush decimate putin troop arm border mean decimate literally time putin get memo expand border mile every foot russia step line,4,24,NAM,25
medium made bigger report read day russia action suggest military attack putin said interview conducting military exercise country right trying conquer world,0,9,NAM,111
putin claim want border russia invades call true,4,11,NAM,80
russia added many troop near border recent day contrary claim president vladimir putin troop would pulled back region,2,15,NAM,65
russia still building force border say top official,0,15,EUR,90
say russia building troop near withdrawing via,2,18,EUR,21
glad madam vice president kamala harris help make crystal clear amp ally putin wwiii democracy amp society many attack amp deceit,4,7,NAM,36
regarding russia take want country border surprise left poland border latvia estonia simply march take another country,4,6,NAM,89
sign withdrawal russian troop near chief say via,2,18,EUR,115
russia continuing build force near west say see moscow official question moscow statement troop withdrawal,2,18,NAM,89
official say seen evidence russia withdrawn troop npr,2,9,NAM,112
president biden warning american prepare economic pain russia invades administration decides levy sanction moscow response,0,16,NAM,60
told military commander wednesday draw plan new combat unit central southeastern europe accused russia sending troop area near instead withdrawi,0,12,NAM,26
scholz biden demand step towards russia statement,0,17,NAM,108
russia added many troop border recent day white house official,2,6,NAM,84
putin winning sitting troop russian territory waste time money running around like keystone cop probably good laugh incompetence diplos,4,10,NAM,97
perhaps know troop sent case country attacked diplomacy world going work putin want reclaim fever dream former ussr glory amp reason crazy,2,19,NAM,108
absolutely russia moved troop artillery arming fortifying polish border distract hillary powerful,4,6,NAM,14
imagine trusting putin say withdrawing troop people dragging sat image argument putin said isnt medium keep lying etc trustworthy like trusting good old kim,4,4,NAM,9
saying biden wrong inciting war threatening putin cover incompetence pro putin going since russia threatened force border chine put missile cuba duhhh,0,0,NAM,59
vladimir putin demand fair treaty russia must respected russia want peace,4,13,ASI,16
