Tweets,Sentiment_Score,Relative_Time,Continent_Code,Reach
hey boy listen want believe building something stop playing sluggish football start scoring opponent like man city game sometimes slow sluggish end becomes draw game want smart game,0,11,SAM,50
worry buddy ever cody got got let focus next step kidd one thing check get chance got move think would great,0,19,EUR,49
exactly played european competition minimum get top big team year europe bounced straight back next season fail,0,14,EUR,98
club spend mill expected get least current excuse young team like wenger already year year dispite much resource like almost year rebuild,0,23,EUR,38
brexit tory slasher film libertarian fox news ignorance nigel farage bigotry,2,3,EUR,93
wow according guy fraud manager world football fuck god help fan like even kit man let alone manager,0,10,EUR,45
supporter baltimore come join saturday morning abbey federal hill gunner take brentford kickoff peacock,4,7,NAM,3
seems like dgw aswell would transfer future player would probably,4,23,EUR,104
right back never played position want young right back probably get know right back,4,7,EUR,99
would love amp appreciate support great discussion debate bants check subscribe channel,2,10,EUR,36
get decent result spur guy back need get goal flowing,4,21,EUR,61
club close heart say back visit whenever played director edu mikel arteta everton feel good connection,4,2,SAM,32
wenger finished wenger emery finished get europa final emery arteta finished season back back need meantime emery beat europa point behind madrid still waiting top,4,6,SAM,111
say arteta still walk even finish catch full hour long gunner podcast danny,2,13,EUR,116
someone said joe gomez would start lol someone make first team,0,8,EUR,111
think joe gomez would choice bit pedantic point definitely start gabriel white,2,14,EUR,14
sign top right back joe gomez would choice centre back,2,18,EUR,29
bravo biden top labor lawyer use whole enforcement bloomberg businessweek,4,18,NAM,37
skippy amp lucky going race starter amp official leprechaun grand slamrock strike lucky mile amp leprechaun chase mile stadium registered yet skip,2,3,NAM,0
seems political class sometimes forgets conflict involves country largest nuclear crazy dude mountain sure serious implication joke,0,14,EUR,47
yes got great player chance massively downplaying west ham amp united every bit poor amp frequently drop point enough game hand day ago amp tactically outclassed mid table team embarrassing,0,5,EUR,111
rival fan banned talking still see city fan talking saka left back big,0,11,EUR,11
tank weapon machine russia whether country use invade unclear,2,12,NAM,16
kylian mbappe mix thierry henry ronaldo tipped lionel messi real madrid icon say paris star good make scream,4,7,SAM,58
custard cream barb fan chattin wham arl twitter,4,5,EUR,2
would take maguire pogba bissaka people call crazy however remember structure key top player perform said jorginho chelsea shit lampard would love people laughed good jorginho since right structure,4,21,EUR,76
talk entzy think sunoo yuna would bestest besties sunghoon chaeryeong would hit well ryujin jungwon friend would dangerous combo omg jungwon gossip ryujin ready use,4,22,EUR,71
think shoulda framed would disappointed get top season opposed said would disappointed even though see thing like top improvement part plan,4,6,NAM,5
watch without babysat van dijk seen england lost depth gomez end nowhere near back line,0,23,EUR,28
good bye boris candle wind panic among ally know brexit unravelling,0,10,EUR,14
hanging onto power claw remaining head state still clinging russian invasion fantasy,0,4,NAM,32
panic among ally know brexit unravelling began unravelling morning referendum result substance nothing pile empty promise catalogue lie,0,15,EUR,67
brexit completely dependent serial liar article michael heseltine worth read,0,0,EUR,96
wish politician calibre around panic among ally know brexit unravelling michael heseltine,0,23,EUR,120
mixed signal russia say bit like mixed covid rule amp boozy party aka staff meeting,0,21,EUR,96
journo said chinese ppl around idea going meanwhile roasting weibo leaving post putin,0,5,NAM,102
boris brexit panic among ally know brexit unravelling michael heseltine,0,3,EUR,69
guardian panic among ally know brexit unravelling worth read via,0,24,EUR,65
trump shake hand first time immediately bounce like two guy wearing inflatable sumo suit,0,14,EUR,24
thank god clownish shamble leading russian crisis rather jeremy corbyn,0,15,EUR,110
panic among ally know brexit unravelling air desperation attack right supporter press fear johnson fall brexit deception crumble,0,12,EUR,0
must return cash donated tory say starmer,0,2,NAM,117
lord heseltine speaks johnson panic among ally know brexit unravelling michael heseltine,0,10,EUR,115
andy vermaut share say little evidence russia withdrawing british prime minister said wednesday currently little evidence russia disengaging military buildup near thank,0,22,EUR,96
little evidence russia withdrawing say boris johnson,0,0,ASI,112
talking russia banking vulnerability hand britain titan christiane tell british bank hsbc tie dark money drug profiteering devoted much,0,12,NAM,50
chrissie like queen practically everyone whole though prefer republic ceremonial president,0,5,EUR,60
separate politics public health vote said would got vaccinated trump,0,18,EUR,17
check article amp video new york time subscriber able read free destructive liar usa treatise boris amp trump,0,5,NAM,122
great piece michael heseltine guardian following last week guardian extraction john major coruscating attack johnson page refuge panic among ally know brexit unravelling,0,0,EUR,25
first thing corrupt tory government ought handing back dirty russian money vladimir putin never take tory seriously receipt,0,13,EUR,111
blair mcdougall said would never become scaremongering,0,4,EUR,80
video call thursday prime minister counterpart scott morrison also called peace stability across warned invading,2,15,AUS,27
awful lot russian connection amp donation amp dwindling ally,0,4,EUR,50
prime minister johnson evidence russia withdrawing border,2,18,ASI,3
poll latest opinion polling say keir starmer popularity inews,2,22,EUR,48
russia withdrawal never threat first place hoax russia announced training exercise month ago hello reuse putin played along ensure energy price amp get rich medium propaganda,0,21,NAM,32
bbc report school england given guidance avoid biased teaching lesson let tory anywhere near classroom,0,21,EUR,36
senior defence official converging adelaide inspect osborne shipyard scott morrison hold fresh talk pact,4,18,NAM,7
watched montage prime minister justin trudeau canada britain french president condemning attempted coup capitol launched urging behalf president trump,4,8,NAM,24
russia withdrawal never threat first place hoax amp money grab energy profit actually bought shish story reuse putin played along ensure energy price amp get rich,0,9,EUR,22
labour party leader keir starmer encourages prime minister return million million dirty cash donated ruling party say necessary reduce russian influence,0,2,ASI,47
must return cash donated tory say starmer,2,5,EUR,47
british prime minister said currently little evidence russia disengaging military buildup near phone call united nation antonio guterres,2,11,ASI,55
crisis plan talk world leader downing street warns juncture world news hold,0,10,EUR,16
top breaking urged russia step back military action saying stand shoulder shoulder kyiv russia blamed escalating tension,0,21,NAM,11
surprise brain chip company neuralink face animal abuse claim,2,11,NAM,28
brain chip startup facing slew animal abuse accusation via,0,10,EUR,51
standing front tesla showroom mall cardboard sign say gay also cheugy,0,19,NAM,15
making tax year pay lifetime good job,4,15,NAM,36
tell twitter user tesla feature coming canada via,4,22,NAM,23
tesla ceo donates billion stock food program receives nothing,0,10,ASI,32
want send people space want send people war,2,9,NAM,19
paid billion last year selling tesla sure follow,4,19,NAM,36
tesla predicts name compile aural super space heater demolish rice cooker industry forever say meta,4,15,NAM,29
expect endorsed democrat election hopefully happen bring minion trump antichrist,4,5,NAM,15
following instagram forever lady robyn denholm say board member tesla advised reach twitter foundation applied grant foundation approved legitimate please,2,10,NAM,28
tesla pay federal tax despite billion personal tax bill,2,19,NAM,8
sold tesla share last november nearly billion bounty given charity according sec received,4,16,NAM,20
someone tell trump pay tax debt fall onto american people stealing taxpayer,0,9,NAM,26
nobody mercy boeing rest launch business refused innovate decade still launching vehicle started life ballistic missile cold war designed economically lift cargo orbit,0,8,EUR,54
neuralink fends animal abuse claim criticism treatment monkey via,4,11,NAM,27
say tesla make political contribution even though absolutely,0,4,NAM,6
allegedly paid tax year politician president congressman american history combined paid entire life time teach,4,16,NAM,21
like similar trump need turn human empathy card,4,16,NAM,54
bad african american american african could run president,0,22,NAM,8
branded disaster world stage daily express told biden first year president absolute disaster free world,0,21,EUR,36
ever president need spied apt sell soul country family gain wealth,4,5,NAM,43
president rejected request former president donald trump shield white house visitor log committee investigating january attack capitol including appointment individual granted entry white house complex day,4,19,NAM,3
call president russian president vladimir putin part increased urgency toward administration,4,3,NAM,10
joe manchin give hard another major biden nominee likely killing nomination,0,15,NAM,22
trump loses release trump secret white house visitor log,4,12,NAM,51
continuing threat russia invading foreign policy crisis colliding one president political vulnerability rising gasoline price home,0,7,NAM,21
president ordering release trump visitor log house committee investigating january rejecting former president donald trump claim executive privilege,4,21,ASI,29
former vice president forbidden receiving communion altar rail sunday catholic church florence south carolina canvassing,2,12,NAM,6
biden order release trump white house log congress,4,1,NAM,35
reporter explains biden got putin blink russian force amassed near,4,2,NAM,37
wrong joe brandon putin could attack biden told ally via,2,18,EUR,22
new info committee investigating capitol riot finally get look trump white house visitor log,4,20,NAM,19
honestly believe hunter biden could respectable person corrupt father joe destroyed son best destroy country,0,14,NAM,45
high gas cost threat pose biden political risk,0,3,NAM,23
stand fight vladimir putin best get fur hat moscow come,2,17,EUR,48
let revisit tweet month set reminder calendar one year disaster biden dems one sitting long time great thanks big guy joe,0,13,NAM,44
hiding joe biden admin begs court bury bombshell report dominion voting machine via,0,5,NAM,52
nothing like hunter biden manipulation ukrainian asset get united state war ukrainian paid front protection deliver yes way united state tax dollar daddy campaign promise,0,7,NAM,6
honorable mention last year trump presidency declassified intel disclosed unlike ever notable effort cnn biden reject trump attempt shield white house visitor log including day january attack via,4,8,NAM,19
sadly past sunday refuse holy communion former vice president father morey said,0,16,NAM,30
hey twitter need apologize president donald john trump misinformation kind told truth truth hillary barack obama james comey clapper brennan apologize banished love,4,1,NAM,8
dan crenshaw proof veterns war member isi policy president geoerge bush provided trey gowdy patriot act investigate benghazi isi patriot act american soil iraq oil gas price come patriot act,0,3,NAM,34
brief alchemist far turning metal gold president opposite patriot post,0,6,NAM,51
report revealed way trump supporter allegedly hope remove president office,2,22,NAM,26
sending stark warning american say could real economic consequence home especially gas pump,0,11,NAM,2
biden tapping step ousted science adviser president replacing top science adviser resigned cloud two individual split position,4,15,NAM,11
report russian president vladimir putin signaled want peaceful path crisis president promised would continue give diplomacy every chance struck skeptical tone moscow intention,4,6,NAM,29
china accused usa playing threat warfare creating tension president warned russian troop still massed near border following moscow announcement partial pullback,0,20,NAM,4
dementia joe also appeared forget administration served vice president started cancer moonshot worked hard administration served last said biden,0,0,NAM,38
uncalled unnecessary inflation hurting everyone biden defending southern border bringing undue harm american america impeach,0,7,NAM,9
new strategy promotes asean centrality via southeast asia underscore ally amp leading regional partner indonesia malaysia singapore amp vietnam,4,10,NAM,9
president rejected former president donald executive privilege claim ordered visitor log released panel investigating deadly attack according letter released wednesday,4,16,NAM,46
president senate democrat first time facing opposition district court nominee home state ser,2,1,NAM,5
warns russia invasion still possible aggressive speech vladimir putin,0,15,NAM,37
richard nixon ronald reagan vladimir putin policy pertaining acquisition land asset,4,5,NAM,5
tell president need get vaccine need get vaccine country one planet one people must support sharing manufacturing help world meet vaccination,4,1,NAM,52
miss made war today took nap afternoon watching band brother woke war biden take credit sotu ending pandemic stopping war never going happen anyway,0,3,NAM,1
clinton campaign senior policy advisor jake sullivan initiated phony claim trump organization communicating kremlin rewarded sullivan making national security advisor man still security clearance,4,16,NAM,12
president german chancellor olaf scholz demanding real step towards russia according statement report afp,0,12,NAM,41
yes summer president anyone say differently deep state operative,4,8,NAM,4
reporter explains biden got putin blink russian force amassed near raw story celebrating year independent journalism,4,8,NAM,7
president rejected another former president donald trump executive privilege claim deciding trump white house visitor log handed investigating attack capitol,0,9,NAM,44
get better maga world suck traitor biden reject trump attempt shield white house visitor log including day january attack cnn via,0,22,NAM,3
trump would give putin everything want never stood belief drivel spout would gone already thank god,4,0,NAM,40
fuel price higher former vice president tapped oil reserve,2,17,NAM,12
story far vladimir putin opts back away invading even temporarily matched every putin chess move effective counter,4,3,NAM,11
german chancellor olaf scholz president urged russia take real step toward statement phone call,2,9,EUR,11
order release trump white house log congress,2,17,NAM,8
president ordering release trump white house visitor log house committee investigating riot,0,21,NAM,52
foreign policy crisis colliding one president political vulnerability rising gasoline price inflation high biden warning american gas price could get higher russia invades,0,13,NAM,36
definitely together putin interesting dialogue elk meat dinner weed vodka also call biden help line upset join debate better showdown joe rogan war,4,11,NAM,33
fear russian attack remaining distinct possibility president sending stark warning american say could real economic consequence home especially gas pump,0,5,NAM,29
biden tap green energy reserve keystone worker say daily caller,4,23,NAM,14
german chancellor olaf scholz president agree situation must assessed extremely serious still risk russian military aggression german government spokesperson steffen hebestreit said,0,10,EUR,19
china accused threat warfare creating tension president warned russian troop still massed near border following moscow announcement partial pullback,0,14,NAM,54
failed trump economy made much worse trump disastrous amp deadly covid virus one reason elected president biden set record million job added,0,15,NAM,4
biden admin defies court ruling hold required oil drilling lease sale biden admin intent preventing american producer developing energy home meet country need lower gas price,0,9,NAM,42
conflict could lead inflation analysis show via,0,24,EUR,5
chief diplomat warned russia could faking partial withdrawal troop,0,2,EUR,1
hope next gop president release biden china note release donald trump white house visitor log committee via,4,2,NAM,40
joe biden leonard peltier covid year prison hospitalize free sign petition via,2,8,NAM,34
president exchanged view situation around agreed situation region extremely serious view massive russian troop buildup border area,0,7,NAM,0
reporter explains biden got putin blink russian force amassed near thank god smart diplomatic president bunch like last guy,4,17,NAM,31
president ordering release former president donald trump white house visitor log part,2,19,NAM,2
germany olaf scholz president call situation extremely serious time india,0,17,ASI,50
russian president vladimir putin signaled want peaceful path crisis president promised would continue give diplomacy every chance,4,16,NAM,47
party politics president founder bnc contributor join discus former president donald trump current president battle,4,0,NAM,37
say russia played bennington john maus band played round round ariel pink confronted russia stated modern classic people still listen michael jackson people still listen bowie,4,2,NAM,15
reporter explains biden got putin blink russian force amassed near,2,3,NAM,13
brutally snub invite despite desperate plea russia war loom world news,0,22,ASI,23
anyone lick sense grasp history know modern time america exporting democracy world enforcing capitalism form golf score card president biden word got dahminate well joe,0,23,ASI,46
biden joke zelensky say info imminent russian war tell come kyiv,0,9,NAM,18
going work like devil bring gas price president promised last week one idea part plan via,4,1,NAM,44
senate president biden stop prevent division hard earned asset afghanistan jetzt unterschreiben via,0,18,EUR,32
took coming office sudden putin trying advance say,0,9,NAM,9
fuck democratic bullshit guarantee trump still president would talk war,0,16,EUR,19
russia conflict russia attack time said appeal wage war,0,12,ASI,12
told putin invading cool long occurred hour est disturb nap time,0,12,NAM,37
hitting bottle little hard since spouting lie president summer inauguration occurred january least admitted president,0,11,NAM,15
sleepy making vladimir putin blink,2,7,NAM,7
cursed catastrophically low approval rating still popular trudeau national post,4,5,NAM,7
would gop need distract private citizen make sense like maybe tweet would made sense trump reelected sound odd wonder know current president,0,2,NAM,47
russia asks next invasion date coordinate vacation plan moscow official via,2,0,NAM,28
trump president giving presidential speech preparing presidential speech cpac amp need input believe better fit lead nation president trump,0,23,NAM,41
biden also announced lured former nih director francis collins retirement serve temporarily president chief science adviser,2,19,NAM,25
legacy mean lot politician like want seen guy nuke world putin give fuck got pretty wild delusion nuke russia defense posture shoot nuke government risk cool,0,4,NAM,50
russia asks next invasion date coordinate vacation plan moscow,2,14,NAM,36
well think president biden inflation joe think good enough reason,4,23,NAM,0
need know today able get released need get free blocking take military attempt thailand russia japan complete mission totally ignoring like participate,0,0,ASI,7
well safe let poor america brutally snub invite despite desperate plea russia war loom,0,4,EUR,25
biden reject trump attempt shield white house visitor log including day january attack cnnpolitics president biden right thing,0,6,NAM,35
america one move putin added troop today telling biden removing troop joe fell putin laughing joe incompetency putin know joe get act together,4,2,NAM,53
unlike gop support vladimir putin patriot support russian dictator instead president,4,13,NAM,21
panicked text started landing mark meadow phone long thousand supporter president donald trump stormed capitol stop congress certifying oof text,4,23,NAM,24
russia asks next invasion date coordinate vacation plan moscow official,2,23,NAM,20
washington feb reuters president expected ask congress defense budget exceeding billion next fiscal year pentagon seek modernize military,4,24,NAM,40
come biden kamala addressing joe biden said black community back got elected voting democrat nothing,2,0,NAM,31
biden time president failing climate crisis,0,4,NAM,16
former president claimed log subject executive privilege letter tuesday white house lawyer rejected claim saying national archive provide record within day house committee,4,20,NAM,39
american stupid anymore east europe stupid game created democrat trying transfer audience election fraud somewhere else president putin smart wise guy,0,12,NAM,55
biden strategy starting look like pretty good one better tricking guy threatened war threatening peace reporter explains biden got putin blink russian force amassed near,4,21,NAM,20
leader washington warning inflation issue could get worse disagree president say russia invades could cost,0,1,NAM,13
biden putin set diplomatic victory dementia joe biden give pipeline,2,24,NAM,55
always know president amp know pay biden president inflation killing everybody amp gas price sky high fix thing got make rule hurting plan presented joe vacation,0,18,NAM,3
biden scholz discus result talk putin zelensky white house president german chancellor olaf scholz discussed result recent talk russian ukrainian president vladimir putin vladimir,2,11,EUR,6
russian video show tank leaving annexed crimea disputing claim according president russian troop still amassed near border,2,19,NAM,26
president expected ask congress billion defense budget next fiscal year pentagon seek modernize military eclipsing record budget request former president donald trump,2,24,ASI,49
brutally snub invite despite desperate plea russia war loom,0,22,NAM,52
know war russia changed online fighting american president,0,2,ASI,17
president biden ordering release trump white house visitor log house committee investigating riot january rejecting former president trump claim executive privilege,2,18,NAM,38
biden russia better invade putin going biden russia seriously better invade zelensky shut going russia invade tlibs hail,0,10,NAM,9
people sign petition share much lend hand senate president biden stop prevent division hard earned asset afghanistan jetzt unterschreiben,4,10,EUR,40
putin young ricky nelson used say ozzie harriet mess around boy,4,7,NAM,34
russia going invade absolute moron shitlibs fault also warmonger getting,0,24,NAM,1
biden perpetrating flagrant crime humanity country military rampaged year amp likely killed million prominent person calling biden impeachment amp prosecution,0,23,NAM,22
joy reid fox trump tom hank saved america former president donald trump worst ever,4,14,NAM,17
republican voted trump went gabbard would make look like actual victory trump absolutely crushed especially among suburban woman,2,1,NAM,48
former president donald trump border wall provided promised result president need abandon failed project,0,21,NAM,28
citizen russia enemy say reveals human cost russia attack would immense,0,0,SAM,35
russia add troop near border official,2,3,ASI,20
breaking recent satellite image russia belarus confirm saber rattling continues,0,5,NAM,18
president neville chamberlain moment prematurely celebrating thought russian president vladimir putin removing trops border turn white house news yesterday fake,0,16,NAM,17
president rejected former president donald trump executive privilege claim ordered white house visitor log released panel investigating deadly attack,2,11,NAM,46
warns russia invasion still possible aggressive speech via,0,5,NAM,47
funniest response yet people want war medium circus covering russian troop already pulled away border going home drill,0,0,NAM,1
remember big bad orange mean tweeter president anymore move day president imagine world would like spent energy something actually make difference,4,20,NAM,54
anyone think people gon change crazier repubs fully embraced authoritarianism pushing putin invade blame pres biden news putin biggest asset west russian could better,4,23,NAM,7
guy bitch complain commander chief joseph robinette biden bless respect government official joe experience know,0,0,NAM,53
stand military explain climate change greatest threat,4,17,NAM,38
president mince word blaming former president trump inciting january attack capitol,0,6,NAM,47
day later guy still bury biden boom pissing laughing,4,6,NAM,31
white house say president track make selection fill upcoming,2,17,NAM,37
campaign colluded russia steele dossier biden kid took money moscow mayor biden giving putin know stop invasion biden say got win fake trump collusion bother stuff,2,22,NAM,0
